{
  "schemaVersion": 1,
  "sourceFormat": "apple_xcstrings",
  "encoding": "UTF-8",
  "source": "{\n  \"sourceLanguage\": \"en\",\n  \"version\": \"1.0\",\n  \"strings\": {\n    \"harbor.first.brazilian.portuguese🧭\": {\n      \"comment\": \"Brazil and Portugal keep distinct zero-selection behavior\",\n      \"localizations\": {\n        \"en\": {\n          \"variations\": {\n            \"plural\": {\n              \"one\": {\n                \"stringUnit\": {\n                  \"state\": \"needs_review\",\n                  \"value\": \"%1$lld %3$n beacon %2$@\"\n                }\n              },\n              \"other\": {\n                \"stringUnit\": {\n                  \"state\": \"translated\",\n                  \"value\": \"%1$lld %3$n beacons %2$@\"\n                }\n              }\n            }\n          }\n        },\n        \"de\": {\n          \"variations\": {\n            \"plural\": {\n              \"one\": {\n                \"stringUnit\": {\n                  \"state\": \"translated\",\n                  \"value\": \"%1$lld Signal %2$@\"\n                }\n              },\n              \"other\": {\n                \"stringUnit\": {\n                  \"state\": \"future_review\",\n                  \"value\": \"%1$lld Signale %2$@\"\n                }\n              }\n            }\n          }\n        },\n        \"pt_BR\": null\n      }\n    },\n    \"harbor.first.european.portuguese🧭\": {\n      \"comment\": \"Brazil and Portugal keep distinct zero-selection behavior\",\n      \"localizations\": {\n        \"en\": {\n          \"variations\": {\n            \"plural\": {\n              \"one\": {\n                \"stringUnit\": {\n                  \"state\": \"needs_review\",\n                  \"value\": \"%1$lld %3$n beacon %2$@\"\n                }\n              },\n              \"other\": {\n                \"stringUnit\": {\n                  \"state\": \"translated\",\n                  \"value\": \"%1$lld %3$n beacons %2$@\"\n                }\n              }\n            }\n          }\n        },\n        \"de\": {\n          \"variations\": {\n            \"plural\": {\n              \"one\": {\n                \"stringUnit\": {\n                  \"state\": \"translated\",\n                  \"value\": \"%1$lld Signal %2$@\"\n                }\n              },\n              \"other\": {\n                \"stringUnit\": {\n                  \"state\": \"future_review\",\n                  \"value\": \"%1$lld Signale %2$@\"\n                }\n              }\n            }\n          }\n        },\n        \"pt-PT\": null\n      }\n    },\n    \"Private regional Portuguese harbor\": {\n      \"shouldTranslate\": false,\n      \"localizations\": {\n        \"en\": {\n          \"variations\": {\n            \"plural\": {\n              \"one\": {\n                \"stringUnit\": {\n                  \"state\": \"needs_review\",\n                  \"value\": \"%1$lld %3$n beacon %2$@\"\n                }\n              },\n              \"other\": {\n                \"stringUnit\": {\n                  \"state\": \"translated\",\n                  \"value\": \"%1$lld %3$n beacons %2$@\"\n                }\n              }\n            }\n          }\n        },\n        \"pt_BR\": null\n      }\n    }\n  }\n}\n",
  "appleTargetLocale": "pt_BR",
  "slots": [
    {
      "id": "harbor.first.brazilian.portuguese🧭",
      "start": 1171,
      "end": 1175
    },
    {
      "id": "harbor.first.european.portuguese🧭",
      "start": 2302,
      "end": 2302
    }
  ]
}
