{
  "schemaVersion": 1,
  "sourceFormat": "apple_xcstrings",
  "encoding": "UTF-16LE-BOM",
  "source": "{\n  \"sourceLanguage\": \"en\",\n  \"version\": \"1.0\",\n  \"strings\": {\n    \"harbor.first.hebrew.deprecated🧭\": {\n      \"comment\": \"Deprecated Hebrew locale spelling remains source-owned\",\n      \"localizations\": {\n        \"en\": {\n          \"variations\": {\n            \"plural\": {\n              \"one\": {\n                \"stringUnit\": {\n                  \"state\": \"needs_review\",\n                  \"value\": \"%1$lld %3$n beacon %2$@\"\n                }\n              },\n              \"other\": {\n                \"stringUnit\": {\n                  \"state\": \"translated\",\n                  \"value\": \"%1$lld %3$n beacons %2$@\"\n                }\n              }\n            }\n          }\n        },\n        \"de\": {\n          \"variations\": {\n            \"plural\": {\n              \"one\": {\n                \"stringUnit\": {\n                  \"state\": \"translated\",\n                  \"value\": \"%1$lld Signal %2$@\"\n                }\n              },\n              \"other\": {\n                \"stringUnit\": {\n                  \"state\": \"future_review\",\n                  \"value\": \"%1$lld Signale %2$@\"\n                }\n              }\n            }\n          }\n        },\n        \"iw\": null\n      }\n    },\n    \"harbor.first.hebrew.deprecated.region🧭\": {\n      \"comment\": \"Deprecated Hebrew locale spelling remains source-owned\",\n      \"localizations\": {\n        \"en\": {\n          \"variations\": {\n            \"plural\": {\n              \"one\": {\n                \"stringUnit\": {\n                  \"state\": \"needs_review\",\n                  \"value\": \"%1$lld %3$n beacon %2$@\"\n                }\n              },\n              \"other\": {\n                \"stringUnit\": {\n                  \"state\": \"translated\",\n                  \"value\": \"%1$lld %3$n beacons %2$@\"\n                }\n              }\n            }\n          }\n        },\n        \"de\": {\n          \"variations\": {\n            \"plural\": {\n              \"one\": {\n                \"stringUnit\": {\n                  \"state\": \"translated\",\n                  \"value\": \"%1$lld Signal %2$@\"\n                }\n              },\n              \"other\": {\n                \"stringUnit\": {\n                  \"state\": \"future_review\",\n                  \"value\": \"%1$lld Signale %2$@\"\n                }\n              }\n            }\n          }\n        },\n        \"iw-IL\": null\n      }\n    },\n    \"Private deprecated Hebrew harbor\": {\n      \"shouldTranslate\": false,\n      \"localizations\": {\n        \"en\": {\n          \"variations\": {\n            \"plural\": {\n              \"one\": {\n                \"stringUnit\": {\n                  \"state\": \"needs_review\",\n                  \"value\": \"%1$lld %3$n beacon %2$@\"\n                }\n              },\n              \"other\": {\n                \"stringUnit\": {\n                  \"state\": \"translated\",\n                  \"value\": \"%1$lld %3$n beacons %2$@\"\n                }\n              }\n            }\n          }\n        },\n        \"iw\": null,\n        \"iw-IL\": null\n      }\n    }\n  }\n}\n",
  "appleTargetLocale": "iw-IL",
  "slots": [
    {
      "id": "harbor.first.hebrew.deprecated🧭",
      "start": 2330,
      "end": 2330
    },
    {
      "id": "harbor.first.hebrew.deprecated.region🧭",
      "start": 4576,
      "end": 4584
    }
  ]
}
