{
  "schemaVersion": 1,
  "sourceFormat": "android",
  "encoding": "UTF-8",
  "source": "<?xml version=\"1.0\"?>\n<resources xmlns:platform=\"http://schemas.android.com/apk/res/android\" xmlns:tools=\"http://schemas.android.com/tools\">\n  <!-- Ordered mutable flags retain fallback plus positive and inverse alternatives. -->\n  <string name=\"anchor\">Open harbor anchor</string>\n  <string name=\"gate.route\" product=\" default \">Open harbor passage</string>\n  <string name=\"gate.route\" product=\"default\" platform:featureFlag=\"neutral.flags.first\">First mutable passage</string>\n  <string name=\"gate.route\" product=\"default\" platform:featureFlag=\"!neutral.flags.first\"><![CDATA[Inverse <quiet> & safe]]></string>\n  <string name=\"gate.route\" product=\"default\" platform:featureFlag=\"neutral.flags.second\">Second mutable passage</string>\n  <string name=\"gate.route\" product=\" tablet \" platform:featureFlag=\"neutral.flags.second\">Tablet mutable passage</string>\n\n  <item type=\"string\" name=\"gate.signal\" product=\"default\">Open harbor signal</item>\n  <item type=\"string\" name=\"gate.signal\" product=\"default\" platform:featureFlag=\"neutral.flags.first\" tools:ignore=\"Protected\" />\n  <string name=\"gate.disabled\" platform:featureFlag=\"neutral.flags.disabled\">Protected disabled passage</string>\n\n  <plurals name=\"gate.count\" product=\"default\">\n    <item quantity=\"one\">%1$d open beacon</item>\n    <item quantity=\"other\">%1$d open beacons</item>\n  </plurals>\n  <plurals name=\"gate.count\" product=\"default\" platform:featureFlag=\"neutral.flags.first\">\n    <item quantity=\"one\" />\n    <item quantity=\"other\">%1$d mutable beacons</item>\n  </plurals>\n\n  <string-array name=\"gate.lanes\" product=\"default\">\n    <item>Open north lane</item>\n    <item>@string/anchor</item>\n  </string-array>\n  <string-array name=\"gate.lanes\" product=\"default\" platform:featureFlag=\"neutral.flags.second\">\n    <item><![CDATA[Mutable <north> & safe]]></item>\n    <item>@string/anchor</item>\n  </string-array>\n  <string translatable=\"false\" name=\"gate.private\">Protected private signal</string>\n</resources>\n",
  "androidFeatureFlags": [
    {
      "name": "neutral.flags.first",
      "readOnly": false,
      "value": false
    },
    {
      "name": "neutral.flags.second",
      "readOnly": false,
      "value": true
    },
    {
      "name": "neutral.flags.disabled",
      "readOnly": true,
      "value": false
    }
  ],
  "slots": [
    {
      "id": "anchor",
      "start": 254,
      "end": 272
    },
    {
      "id": "gate.route",
      "start": 330,
      "end": 349
    },
    {
      "id": "gate.route@flag=neutral.flags.first",
      "start": 448,
      "end": 469
    },
    {
      "id": "gate.route@flag=!neutral.flags.first",
      "start": 569,
      "end": 603
    },
    {
      "id": "gate.route@flag=neutral.flags.second",
      "start": 703,
      "end": 725
    },
    {
      "id": "gate.route@product=tablet@flag=neutral.flags.second",
      "start": 826,
      "end": 848
    },
    {
      "id": "gate.signal",
      "start": 918,
      "end": 936
    },
    {
      "id": "gate.signal@flag=neutral.flags.first",
      "start": 1071,
      "end": 1073
    },
    {
      "id": "gate.count",
      "variant": "one",
      "start": 1261,
      "end": 1277
    },
    {
      "id": "gate.count",
      "variant": "other",
      "start": 1312,
      "end": 1329
    },
    {
      "id": "gate.count@flag=neutral.flags.first",
      "variant": "one",
      "start": 1466,
      "end": 1468
    },
    {
      "id": "gate.count@flag=neutral.flags.first",
      "variant": "other",
      "start": 1496,
      "end": 1516
    },
    {
      "id": "gate.lanes[0]",
      "start": 1601,
      "end": 1616
    },
    {
      "id": "gate.lanes@flag=neutral.flags.second[0]",
      "start": 1781,
      "end": 1815
    }
  ]
}
