{
  "schemaVersion": 1,
  "sourceFormat": "android",
  "encoding": "UTF-8",
  "source": "<?xml version=\"1.0\" encoding=\"UTF-8\"?>\n<resources><xml:string name=\"hidden\">Private</xml:string><string name=\"signal\">Quiet bay</string></resources>\n",
  "slots": [
    {
      "id": "signal",
      "start": 118,
      "end": 127
    }
  ]
}
