{
  "schemaVersion": 1,
  "sourceFormat": "android",
  "encoding": "UTF-16LE-BOM",
  "source": "<?xml version=\"1.0\"?>\n<resources xmlns:x=\"urn:oasis:names:tc:xliff:document:1.2\">\n  <string name=\"visible\">Visible harbor</string>\n  <string name=\"protected_scalar\" translatable=\"false\">\"Harbor's  quiet\" %s %d</string>\n  <item type=\"string\" name=\"protected_generic\" format=\"string\" translatable=\"false\">West\\'s \\u0041 quay</item>\n  <string-array name=\"protected_routes\" translatable=\"false\">\n    <item>South\\'s  pier</item>\n    <item>\"East's calm\"</item>\n    <item>North <x:g id=\"bad id\">%1$s</x:g> lane</item>\n    <item><x:g id=\"other\"><b>%1$s</b></x:g></item>\n  </string-array>\n  <bag type=\"string-array\" name=\"protected_bag_routes\" translatable=\"false\">\n    <item>Bay\\'s quiet</item>\n  </bag>\n  <plurals name=\"protected_counts\" translatable=\"false\">\n    <item quantity=\"one\">One signal\\'s shore</item>\n    <item quantity=\"other\">%s then %d</item>\n  </plurals>\n  <bag type=\"plurals\" name=\"protected_bag_counts\" translatable=\"false\">\n    <item quantity=\"other\">Two beacon\\'s lane</item>\n  </bag>\n</resources>\n",
  "slots": [
    {
      "id": "visible",
      "start": 216,
      "end": 244
    }
  ]
}
