{
  "schemaVersion": 1,
  "sourceFormat": "apple_strings",
  "encoding": "UTF-16BE-BOM",
  "source": "/* Preserve this 🧭 comment, original layout, and Foundation grammar. */\n{\n  /* Keep double-quoted token delimiters. */\n  \"double.key\" = \"North \\\"pier\\\"\";\n\n  // Single-quoted values must retain their original delimiter.\n  'single.key' = 'Pilot\\'s \"quiet\" lane';\n\n  // Unquoted values become safely quoted only when translated.\n  unquoted.key = open_route;\n\n  // Foundation's key-only shortcut has a zero-width insertion slot.\n  \"shorthand.key\";\n\n  /* Punctuation in quoted keys must never become a structural delimiter. */\n  \"punct;=key\" = \"Wait // calmly\";\n\n  // Original Unicode-escape spelling belongs to the protected key skeleton.\n  \"escaped\\U002Ekey\" = \"Trail %1$@\";\n\n  \"line.break\" = \"North%nSouth\";\n}\n",
  "slots": [
    {
      "id": "double.key",
      "start": 278,
      "end": 306
    },
    {
      "id": "single.key",
      "start": 478,
      "end": 520
    },
    {
      "id": "unquoted.key",
      "start": 690,
      "end": 710
    },
    {
      "id": "shorthand.key",
      "start": 888,
      "end": 888
    },
    {
      "id": "punct;=key",
      "start": 1084,
      "end": 1112
    },
    {
      "id": "escaped.key",
      "start": 1322,
      "end": 1342
    },
    {
      "id": "line.break",
      "start": 1386,
      "end": 1410
    }
  ]
}
